{
  "classification_hints": {
    "domains": [
      "schemas",
      "security"
    ],
    "likely_hvc_class": "vertical_defect_slice",
    "requires_human_review": true,
    "requires_parallelism": false
  },
  "constraints": [
    "Preserve existing source artifacts.",
    "Use capsule-first context for dispatched agents."
  ],
  "context_policy": {
    "hydrate_on_demand": true,
    "max_initial_tokens": 1800,
    "mode": "capsule_first"
  },
  "created_at": "2026-06-12T06:48:48Z",
  "goal_id": "goal-20260612T064848Z-fix-admin-webspa-tenant",
  "goals": [
    {
      "id": "G1",
      "priority": "must",
      "statement": "Fix admin webspa tenant workspace authorization screen at https://admin.nouveauricheglobalgroup.com/#/403?reason=missing-tenant where GET /v1/admin/tenants/workspaces returns 200 but the SPA still renders Workspace authorization error/missing tenant. Investigate frontend/backend contract for multi-tenant workspace response shape and repair with tests.",
      "success_criteria": [
        "A valid GoalSpec exists before HVC classification.",
        "The requested outcome is implemented with evidence and tests."
      ]
    }
  ],
  "non_goals": [
    "Do not perform unrelated repository-wide rewrites."
  ],
  "risk_level": "high",
  "schema_version": "1.0",
  "source": {
    "conversation_ref": null,
    "prompt_excerpt": "Fix admin webspa tenant workspace authorization screen at https://admin.nouveauricheglobalgroup.com/#/403?reason=missing-tenant where GET /v1/admin/tenants/workspaces returns 200 but the SPA still renders Workspace authorization error/missing tenant. Investigate frontend/backend contract for multi-tenant workspace response shape and repair with tests.",
    "prompt_hash": "sha256:b02d86fe184d4f8dc93f891117c40960e82720629c9f4042915379bd4cf5e437",
    "repo_ref": "agent-hub"
  },
  "success_criteria": [
    "A valid GoalSpec exists before HVC classification.",
    "The requested outcome is implemented with evidence and tests."
  ],
  "title": "Fix admin webspa tenant workspace authorization screen at https://admin"
}
